;NUMBER;CLASSIF;DATE_CASE;REF;NOT_COUNTRY;SUBJET;PROD_CAT;TYPE;RISK_DECISION;ACTION_TAKEN;DISTRIBUTION_STAT;PRODUCT;HAZARDS;HAZARDS_CAT;COUNT_ORIGEN;COUNT_DESTIN;COUNT_CONCERN
2039;2084.0;information for attention;2019-03-07;2019.0903;Romania;ochratoxin A (25.19 µg/kg - ppb) in raisins from Pakistan;fruits and vegetables;food;serious;re-dispatch;distribution restricted to notifying country;raisins;ochratoxin a;mycotoxins;Pakistan;Romania;INFOSAN
2040;2086.0;alert;2019-03-07;2019.0904;Germany;Salmonella (presence /25g) in frozen minced meat skewer from Germany;meat and meat products (other than poultry);food;serious;withdrawal from the market;distribution to other member countries;frozen minced meat skewer;salmonella;pathogenic micro-organisms;Germany;Belgium,France,Spain; 
2041;2088.0;border rejection;2019-03-07;2019.0897;Norway;migration of formaldehyde (24 mg/kg - ppm) from bamboo bottles and dinner sets for kids from China;food contact materials;fcm;undecided;official detention;product not (yet) placed on the market;bamboo bottles and dinner sets for kids;migration of formaldehyde;migration;China; ;Norway
2042;2090.0;information for attention;2019-03-07;2019.0906;Spain;too high content of sulphite (2822 mg/kg - ppm) in raisins from Chile;fruits and vegetables;food;not serious; ;distribution restricted to notifying country;raisins;too high content of sulphite;food additives and flavourings;Chile;Spain; 
2043;2092.0;border rejection;2019-03-07;2019.0901;United Kingdom;E 385 - calcium disodium ethylene diamine tetra acetate (CDEDTA) unauthorised in soft drink from China;non-alcoholic beverages;food;not serious; ;product not (yet) placed on the market;soft drink;e 385 - calcium disodium ethylene diamine tetra acetate (cdedta) unauthorised;food additives and flavourings;China; ;United Kingdom
2044;2094.0;border rejection;2019-03-06;2019.0890;Italy;migration of manganese (2.9 mg/kg - ppm) and too high level of overall migration (1084 mg/kg - ppm) from stainless steel strainers set from China;food contact materials;fcm;undecided;placed under customs seals;product not (yet) placed on the market;stainless steel strainers set;migration of manganese,too high level of overall migration;metals,migration;China; ;Hong Kong,Italy
2045;2096.0;information for attention;2019-03-06;2019.0893;Lithuania;"too high level of radioactivity (1843; 732; 2125 BQ/kg) in mushrooms (chanterelles) from Ukraine";fruits and vegetables;food;serious;destruction;product (presumably) no longer on the market;mushrooms (chanterelles);too high level of radioactivity;radiation;Ukraine;Lithuania;INFOSAN
2046;2098.0;border rejection;2019-03-06;2019.0888;United Kingdom;Salmonella (presence /25g) in in frozen salted chicken half breasts from Brazil;poultry meat and poultry meat products;food;serious;re-dispatch;product not (yet) placed on the market;in frozen salted chicken half breasts;salmonella;pathogenic micro-organisms;Brazil; ;Ireland,United Kingdom
2047;2100.0;alert;2019-03-06;2019.0889;Estonia;benzo(a)pyrene (4.3 µg/kg - ppb) and polycyclic aromatic hydrocarbons (15.3 µg/kg - ppb) in refined rapeseed oil from Estonia;fats and oils;food;serious;withdrawal from recipient(s);distribution to other member countries;refined rapeseed oil;benzo(a)pyrene,polycyclic aromatic hydrocarbons;environmental pollutants,environmental pollutants;Estonia;Estonia,Finland,Latvia,Lithuania; 
2048;2101.0;information for attention;2019-03-06;2019.0894;Spain;bulging packaging (gas formation) of canned fried tomato sauce from Spain;fruits and vegetables;food;serious;withdrawal from the market;distribution to non-member countries;canned fried tomato sauce;bulging packaging;packaging defective / incorrect;Spain;Andorra,Cape Verde,Spain;INFOSAN
2049;2103.0;information for follow-up;2019-03-06;2019.0886;Italy;parasitic infestation with Anisakis of chilled monkfish (Lophius piscatorius) from France;fish and fish products;food;not serious;seizure;distribution to other member countries;chilled monkfish (lophius piscatorius);parasitic infestation with anisakis;parasitic infestation;France;Belgium,Germany,Italy,Spain; 
2050;2105.0;border rejection;2019-03-06;2019.0883;Finland;Salmonella enterica ser. Münster (presence /25g) and Salmonella enterica ser. Tennessee (presence /25g) in rape seed meal from Russia;feed materials;feed;not serious;physical/chemical treatment;product not (yet) placed on the market;rape seed meal;salmonella enterica ser. münster,salmonella enterica ser. tennessee;pathogenic micro-organisms,pathogenic micro-organisms;Russia; ;Finland
2051;2107.0;information for attention;2019-03-06;2019.0879;Italy;dried figs from Turkey infested with larvae of insects;fruits and vegetables;food;not serious;withdrawal from the market;distribution restricted to notifying country;dried figs;infested with larvae of insects;foreign bodies;Turkey;Italy; 
2052;2109.0;information for attention;2019-03-05;2019.0872;Netherlands;unauthorised substance methamidophos (0.07 mg/kg - ppm) in chilled mango cubes from South Africa;fruits and vegetables;food;serious;detained by operator;product (presumably) no longer on the market;chilled mango cubes;unauthorised substance methamidophos;pesticide residues;South Africa; ;INFOSAN,Netherlands
2053;2111.0;alert;2019-03-05;2019.0875;France;ciguatera poisoning suspected (4 out of 4 samples) to be caused by frozen wahoo loin fillets(Acanthocybium solandri) from Vietnam;fish and fish products;food;serious;withdrawal from the market;information on distribution not (yet) available;frozen wahoo loin fillets(acanthocybium solandri);ciguatera poisoning suspected;natural toxins (other);Vietnam;France;INFOSAN
2054;2113.0;alert;2019-03-05;2019.0870;Denmark;fish undeclared on chilled tandoori chicken salad dish from the Netherlands;prepared dishes and snacks;food;serious;recall from consumers;distribution restricted to notifying country;chilled tandoori chicken salad dish;fish undeclared;allergens;Netherlands;Denmark; 
2055;2115.0;information for attention;2019-03-05;2019.0865;France;Listeria monocytogenes (260 CFU/g) in chilled cod fillets (Gadus morhua) from Denmark;fish and fish products;food;serious;recall from consumers;product (presumably) no longer on the market;chilled cod fillets (gadus morhua);listeria monocytogenes;microbial contaminants (other);Denmark;France; 
2056;2117.0;information for attention;2019-03-05;2019.0874;Germany;migration of primary aromatic amines (6532 µg/kg - ppb) from ladles from China;food contact materials;fcm;serious;withdrawal from the market;product (presumably) no longer on the market;ladles;migration of primary aromatic amines;migration;China;Germany;INFOSAN
2057;2119.0;information for attention;2019-03-05;2019.0871;Netherlands;Salmonella (presence /25g) in live mussels from the Netherlands;bivalve molluscs and products thereof;food;serious;informing authorities;product (presumably) no longer on the market;live mussels;salmonella;pathogenic micro-organisms;Netherlands;Belgium; 
2058;2121.0;border rejection;2019-03-05;2019.0867;Bulgaria;esfenvalerate (0.387 mg/kg - ppm) in oranges from Turkey;fruits and vegetables;food;serious;placed under customs seals;product allowed to travel to destination under customs seals;oranges;esfenvalerate;pesticide residues;Turkey; ;Bulgaria
2059;2123.0;alert;2019-03-04;2019.0846;Netherlands;pyrrolizidine alkaloids (3695 µg/kg - ppb) in St John's wort (Hypericum perforatum) dry extract from Spain;dietetic foods, food supplements, fortified foods;food;serious;destruction;distribution to other member countries;st john's wort (hypericum perforatum) dry extract;pyrrolizidine alkaloids;natural toxins (other);Spain;France,Japan,Netherlands,Switzerland;INFOSAN
2060;2125.0;information for follow-up;2019-03-04;2019.0857;United Kingdom;poor traceability records (potential tampering with passport) for horses from the United Kingdom and Ireland, slaughtered in Germany;meat and meat products (other than poultry);food;undecided; ;distribution to other member countries;horses;poor traceability records;poor or insufficient controls;Ireland,United Kingdom;Belgium,China,Finland,Germany,Ireland,Italy,Poland,United Kingdom;Commission Services,France
2061;2127.0;information for follow-up;2019-03-04;2019.0840;Italy;parasitic infestation with Anisakis of chilled mackerel from Ireland, via the Netherlands;fish and fish products;food;not serious;destruction;distribution to other member countries;chilled mackerel;parasitic infestation with anisakis;parasitic infestation;Ireland;Belgium,Croatia,Czech Republic,Germany,Hungary,Italy,Poland,Slovenia,Spain;France,Netherlands
2062;2129.0;alert;2019-03-04;2019.0845;Netherlands;pyrrolizidine alkaloids (3201 µg/kg - ppb) in food supplement containing St John's wort (Hypericum perforatum) from the Netherlands;dietetic foods, food supplements, fortified foods;food;serious;destruction;distribution to other member countries;food supplement containing st john's wort (hypericum perforatum);pyrrolizidine alkaloids;natural toxins (other);Netherlands;Belgium,Netherlands;Germany
2063;2131.0;information for follow-up;2019-03-04;2019.0861;Sweden;unauthorised placing on the market of valerian root extract (Valeriana officinalis) from the United States, via the United Kingdom;dietetic foods, food supplements, fortified foods;food;undecided;recall from consumers;no distribution from notifying country;valerian root extract (valeriana officinalis);unauthorised placing on the market;composition;United States;Sweden;Finland,United Kingdom
2064;2133.0;information for attention;2019-03-04;2019.0838;United Kingdom;milk ingredient undeclared on chilled chicken Chinese takeaway products from the United Kingdom;prepared dishes and snacks;food;serious;recall from consumers;distribution to non-member countries;chilled chicken chinese takeaway products;milk ingredient undeclared;allergens;United Kingdom;Gibraltar,Guernsey,Jersey,United Kingdom;INFOSAN
2065;2135.0;alert;2019-03-04;2019.0847;Sweden;unauthorised novel food ingredient yohimbe bark extract in food supplement from unknown origin;dietetic foods, food supplements, fortified foods;food;serious; ;product traded online;food supplement;unauthorised novel food ingredient yohimbe bark extract;novel food;unknown origin; ;Malta,Sweden
2066;2137.0;information for follow-up;2019-03-04;2019.0850;Italy;parasitic infestation with Pseudoterranova of chilled monkfish (Lophius piscatorius) from France;fish and fish products;food;not serious;destruction;no distribution from notifying country;chilled monkfish (lophius piscatorius);parasitic infestation with pseudoterranova;parasitic infestation;France;Italy; 
2067;2139.0;border rejection;2019-03-04;2019.0863;Netherlands;unauthorised genetically modified (P-35S) white rice from China;cereals and bakery products;food;undecided;official detention;product not (yet) placed on the market;white rice;unauthorised genetically modified;genetically modified food or feed;China; ;Netherlands
2068;2141.0;information for attention;2019-03-04;2019.0859;Sweden;unauthorised substance 5-hydroxytryptophan (5-HTP) and unauthorised novel food ingredients Hoodia gordonii and yohimbe bark extract in food supplement from the United States;dietetic foods, food supplements, fortified foods;food;serious;informing authorities;product traded online;food supplement;unauthorised novel food ingredient hoodia gordonii,unauthorised novel food ingredient yohimbe bark extract,unauthorised substance 5-hydroxytryptophan (5-htp);novel food,novel food,composition;United States; ;Sweden,United Kingdom
2069;2143.0;border rejection;2019-03-04;2019.0855;Greece;Salmonella enterica ser. Haelsingborg (presence /25g) in fish meal from the United States;feed materials;feed;not serious;physical/chemical treatment;product not (yet) placed on the market;fish meal;salmonella enterica ser. haelsingborg;pathogenic micro-organisms;United States; ;Greece
2070;2145.0;border rejection;2019-03-04;2019.0849;Slovenia;peppers from Egypt infested with moulds;fruits and vegetables;food;not serious;official detention;product not (yet) placed on the market;peppers;infested with moulds;microbial contaminants (other);Egypt; ;Slovakia,Slovenia
2071;2147.0;alert;2019-03-01;2019.0820;Netherlands;ochratoxin A (44 µg/kg - ppb) in soychunks from India, via the United Kingdom;fruits and vegetables;food;serious;withdrawal from the market;distribution to other member countries;soychunks;ochratoxin a;mycotoxins;India;Belgium,France,Germany,Hungary,Netherlands;INFOSAN,United Kingdom
2072;2149.0;border rejection;2019-03-01;2019.0807;Greece;Salmonella enterica ser. Braenderup (presence /25g) and Salmonella enterica ser. München (presence /25g) in sesame seeds from Sudan;nuts, nut products and seeds;food;serious;re-dispatch;product not (yet) placed on the market;sesame seeds;salmonella enterica ser. braenderup,salmonella enterica ser. münchen;pathogenic micro-organisms,pathogenic micro-organisms;Sudan; ;Greece
2073;2151.0;border rejection;2019-03-01;2019.0808;Greece;Salmonella (presence in 1 out of 5 samples /25g) in sesame seeds from Sudan;nuts, nut products and seeds;food;serious;physical/chemical treatment;product not (yet) placed on the market;sesame seeds;salmonella;pathogenic micro-organisms;Sudan; ;Greece
2074;2153.0;border rejection;2019-03-01;2019.0818;Greece;"aflatoxins (B1 = 62; Tot. = 69.2 µg/kg - ppb) in groundnut kernels from India";nuts, nut products and seeds;food;serious;re-dispatch;product not (yet) placed on the market;groundnut kernels;aflatoxins;mycotoxins;India; ;Greece
2075;2155.0;border rejection;2019-03-01;2019.0815;Greece;Salmonella enterica ser. Tennessee (presence /25g) in sesame seeds from Sudan;nuts, nut products and seeds;food;serious;physical/chemical treatment;product not (yet) placed on the market;sesame seeds;salmonella enterica ser. tennessee;pathogenic micro-organisms;Sudan; ;Greece
2076;2157.0;border rejection;2019-03-01;2019.0828;Greece;Salmonella (presence /25g) in sesame seeds from Sudan;nuts, nut products and seeds;food;serious;physical/chemical treatment;product not (yet) placed on the market;sesame seeds;salmonella;pathogenic micro-organisms;Sudan; ;Greece
2077;2159.0;alert;2019-03-01;2019.0826;Netherlands;Salmonella enterica ser. Enteritidis (in 2 out of 5 samples /25g) in chilled chicken thighs from Poland;poultry meat and poultry meat products;food;serious;withdrawal from recipient(s);distribution to other member countries;chilled chicken thighs;salmonella enterica ser. enteritidis;pathogenic micro-organisms;Poland;United Kingdom;Denmark,Netherlands
2078;2161.0;alert;2019-03-01;2019.0816;Netherlands;pyrrolizidine alkaloids (2459 µg/kg - ppb) in St. John's wort capsules from the Netherlands;dietetic foods, food supplements, fortified foods;food;undecided;informing recipient(s);distribution to other member countries;st. john's wort capsules;pyrrolizidine alkaloids;natural toxins (other);Netherlands;Belgium; 
2079;2163.0;border rejection;2019-03-01;2019.0835;Germany;Salmonella enterica ser. Senftenberg (presence /25g) in black pepper from Brazil;herbs and spices;food;serious;re-dispatch;product not (yet) placed on the market;black pepper;salmonella enterica ser. senftenberg;pathogenic micro-organisms;Brazil; ;Germany
2080;2165.0;information for follow-up;2019-03-01;2019.0806;Italy;Listeria monocytogenes (in 5 out 5 samples, < 10 CFU/g) in frozen smoked salmon from Estonia;fish and fish products;food;undecided;official detention;no distribution from notifying country;frozen smoked salmon;listeria monocytogenes;microbial contaminants (other);Estonia;Italy;European Food Safety Authority
2081;2167.0;information for attention;2019-03-01;2019.0804;United Kingdom;2,4-dinitrophenol (DNP) offered online for sale;dietetic foods, food supplements, fortified foods;food;serious;informing authorities;product traded online;dnp;2,4-dinitrophenol (dnp),offered online for sale;composition,adulteration / fraud; ; ;INFOSAN,Turkey,United Kingdom,United States
2082;2169.0;border rejection;2019-03-01;2019.0813;United Kingdom;too high content of sulphite (3353 mg/kg - ppm) in dried apricots from Uzbekistan;fruits and vegetables;food;not serious;import not authorised;product not (yet) placed on the market;dried apricots;too high content of sulphite;food additives and flavourings;Uzbekistan; ;United Kingdom
2083;2171.0;information for attention;2019-03-01;2019.0803;Netherlands;"aflatoxins (B1 =6.8; Tot. = 23 µg/kg - ppb) in hazelnuts from Turkey";nuts, nut products and seeds;food;serious;withdrawal from the market;distribution restricted to notifying country;hazelnuts;aflatoxins;mycotoxins;Turkey;Netherlands;INFOSAN
2084;2173.0;border rejection;2019-03-01;2019.0834;Germany;Salmonella enterica ser. Morehead (presence /25g) in black pepper from Brazil;herbs and spices;food;serious;re-dispatch;product not (yet) placed on the market;black pepper;salmonella enterica ser. morehead;pathogenic micro-organisms;Brazil; ;Germany
2085;2175.0;border rejection;2019-03-01;2019.0830;Germany;Salmonella enterica ser. Minnesota (presence /25g) in black pepper from Brazil;herbs and spices;food;serious;re-dispatch;product not (yet) placed on the market;black pepper;salmonella enterica ser. minnesota;pathogenic micro-organisms;Brazil; ;Germany
2086;2177.0;border rejection;2019-03-01;2019.0825;Germany;Salmonella enterica ser. Glostrup (presence /25g) in black pepper from Brazil;herbs and spices;food;serious;re-dispatch;product not (yet) placed on the market;black pepper;salmonella enterica ser. glostrup;pathogenic micro-organisms;Brazil; ;Germany
2087;2179.0;border rejection;2019-03-01;2019.0812;Belgium;aflatoxins (B1 = 6.8 µg/kg - ppb) in basmati rice from Pakistan;cereals and bakery products;food;serious;re-dispatch;product not (yet) placed on the market;basmati rice;aflatoxins;mycotoxins;Pakistan; ;Belgium,Germany
2088;2181.0;information for attention;2019-02-28;2019.0792;Romania;dimethoate (0.2 mg/kg - ppm) and unauthorised substance omethoate (0.056 mg/kg - ppm) in apples from the Republic of North Macedonia;fruits and vegetables;food;serious;no stock left;distribution restricted to notifying country;apples;dimethoate,unauthorised substance omethoate;pesticide residues,pesticide residues;Republic of North Macedonia;Romania;INFOSAN
2089;2183.0;information for attention;2019-02-28;2019.0802;France;histamine (273.1 mg/kg - ppm) in frozen pre-cooked skipjack tuna loin (Katsuwonus pelamis) from Thailand;fish and fish products;food;serious;informing consignor;distribution restricted to notifying country;frozen pre-cooked skipjack tuna loin (katsuwonus pelamis);histamine;biological contaminants (other);Thailand;France;Commission Services,INFOSAN
2090;2185.0;border rejection;2019-02-28;2019.0791;Bulgaria;aflatoxins (B1 = 8.1 µg/kg - ppb) in shrivelled hazelnut kernels from Georgia;nuts, nut products and seeds;food;serious;re-dispatch;product not (yet) placed on the market;shrivelled hazelnut kernels;aflatoxins;mycotoxins;Georgia; ;Bulgaria,Germany
2091;2187.0;information for attention;2019-02-28;2019.0795;United Kingdom;2,4-dinitrophenol (DNP) offered online for sale;dietetic foods, food supplements, fortified foods;food;serious;informing authorities;product traded online;dnp;2,4-dinitrophenol (dnp);composition;unknown origin; ;INFOSAN,South Korea,Ukraine,United Kingdom,United States
2092;2189.0;alert;2019-02-28;2019.0783;United Kingdom;milk ingredient undeclared on dark chocolate chips from the United Kingdom;confectionery;food;serious;public warning - press release;distribution to other member countries;dark chocolate chips;milk ingredient undeclared;allergens;United Kingdom;Ireland,United Kingdom; 
2093;2191.0;alert;2019-02-28;2019.0800;Belgium;unauthorised colours Sudan 1 (>3000 µg/kg - ppb), Sudan 3 (655 µg/kg - ppb), Sudan 4 (>3000 µg/kg - ppb) and Para Red (661 µg/kg - ppb) in chili powder from Turkey, via Belgium;herbs and spices;food;serious;destruction;distribution to other member countries;chili powder;unauthorised colour para red,unauthorised colour sudan 1,unauthorised colour sudan 3,unauthorised colour sudan 4;composition,composition,composition,composition;Turkey;France;Belgium,Commission Services,INFOSAN
2094;2193.0;information for attention;2019-02-28;2019.0777;United Kingdom;2,4-dinitrophenol (DNP) offered online for sale;dietetic foods, food supplements, fortified foods;food;serious;informing recipient(s);product traded online;dnp;2,4-dinitrophenol (dnp);composition;India; ;INFOSAN,United Kingdom,United States
2095;2195.0;information for attention;2019-02-28;2019.0785;United Kingdom;2,4-dinitrophenol (DNP) offered online for sale;dietetic foods, food supplements, fortified foods;food;serious;informing authorities;product traded online;dnp (2,4-dinitrophenol);2,4-dinitrophenol (dnp);composition;China;United Kingdom;INFOSAN,United States
2096;2197.0;border rejection;2019-02-28;2019.0797;Bulgaria;esfenvalerate (0.144 mg/kg - ppm) in oranges from Turkey;fruits and vegetables;food;serious;placed under customs seals;product not (yet) placed on the market;oranges;esfenvalerate;pesticide residues;Turkey; ;Bulgaria
2097;2199.0;border rejection;2019-02-28;2019.0788;United Kingdom;aflatoxins (B1 = 33.8 µg/kg - ppb) in groundnut kernels for birdfeed from Senegal;feed materials;feed;serious;physical/chemical treatment;product not (yet) placed on the market;groundnut kernels for birdfeed;aflatoxins;mycotoxins;Senegal; ;United Kingdom
2098;2102.0;alert;2019-03-06;2019.0891;Netherlands;unauthorised substance aldrin and prohibited substance dieldrin (sum 0.082 mg/kg - ppm) in butternut from South Africa;fruits and vegetables;food;serious;informing recipient(s);distribution to other member countries;butternut;prohibited substance dieldrin,unauthorised substance aldrin;pesticide residues,pesticide residues;South Africa;Belgium,France,Germany,Netherlands,Switzerland,United Kingdom;INFOSAN
2099;2104.0;information for attention;2019-03-06;2019.0885;United Kingdom;pork products from China offered online for sale;meat and meat products (other than poultry);food;not serious;informing authorities;product traded online;pork products;offered online for sale;adulteration / fraud;China; ;Canada,United Kingdom
2100;2106.0;border rejection;2019-03-06;2019.0881;Greece;Salmonella enterica ser. Telelkebir (presence /25g) in fish meal from the United States;feed materials;feed;not serious;physical/chemical treatment;product not (yet) placed on the market;fish meal;salmonella enterica ser. telelkebir;pathogenic micro-organisms;United States; ;Greece
2101;2108.0;information for follow-up;2019-03-05;2019.0876;Spain;prohibited substance rum ether in powdered cherry flavoured candies from Spain, with raw material from the United States;confectionery;food;not serious;withdrawal from the market;distribution to other member countries;powdered cherry flavoured candies;prohibited substance rum ether;food additives and flavourings;Spain,United States;Belarus,France,Hungary,Italy,Latvia,Lithuania,Portugal,Senegal,Slovenia,Spain,Sweden,United Kingdom; 
2102;2110.0;border rejection;2019-03-05;2019.0866;United Kingdom;unauthorised substance carbofuran (0.01 mg/kg - ppm) in chillies from India;fruits and vegetables;food;serious; ;product not (yet) placed on the market;chillies;unauthorised substance carbofuran;pesticide residues;India; ;United Kingdom
2103;2112.0;information for follow-up;2019-03-05;2019.0877;Italy;dried plums from Chile infested with larvae of insects;fruits and vegetables;food;not serious;withdrawal from the market;distribution to other member countries;dried plums;infested with larvae of insects;foreign bodies;Chile;Italy,Slovenia; 
2104;2114.0;alert;2019-03-05;2019.0868;Netherlands;gluten and wheat undeclared on chilled bami goreng from the Netherlands, manufactured in Belgium;prepared dishes and snacks;food;serious;recall from consumers;no distribution to other member countries;chilled bami goreng;gluten undeclared,wheat undeclared;allergens,allergens;Belgium,Netherlands;Belgium,Netherlands; 
2105;2116.0;alert;2019-03-05;2019.0860;Denmark;foreign body (metal blade 8 cm) in lid containing red berries from Denmark;other food product / mixed;food;serious;informing recipient(s);distribution to other member countries;lid containing red berries;foreign body;foreign bodies;Denmark;Finland; 
2106;2118.0;border rejection;2019-03-05;2019.0873;Lithuania;"aflatoxins (B1 = 35; Tot. = 41.8 µg/kg - ppb) in groundnuts in shell from China";nuts, nut products and seeds;food;serious;destruction;product not (yet) placed on the market;groundnuts in shell;aflatoxins;mycotoxins;China; ;Lithuania
2107;2120.0;information for attention;2019-03-05;2019.0869;Italy;parasitic infestation with Anisakis simplex of chilled monkfish (Lophius piscatorius) from France;fish and fish products;food;not serious;no action taken;product (presumably) no longer on the market;chilled monkfish (lophius piscatorius);parasitic infestation with anisakis simplex;parasitic infestation;France;Italy; 
2108;2122.0;alert;2019-03-04;2019.0851;Sweden;high content of caffeine (600 mg) and of synephrine and unauthorised novel food ingredient yohimbe bark extract in food supplement from the United States;dietetic foods, food supplements, fortified foods;food;serious;informing authorities;product traded online;food supplement;high content of caffeine,high content of synephrine,unauthorised novel food ingredient yohimbe bark extract;food additives and flavourings,composition,novel food;United States; ;Commission Services,INFOSAN,Italy,Sweden,United Kingdom
