;NUMBER;CLASSIF;DATE_CASE;REF;NOT_COUNTRY;SUBJET;PROD_CAT;TYPE;RISK_DECISION;ACTION_TAKEN;DISTRIBUTION_STAT;PRODUCT;HAZARDS;HAZARDS_CAT;COUNT_ORIGEN;COUNT_DESTIN;COUNT_CONCERN
734;769.0;alert;2019-07-04;2019.2395;Poland;unauthorised substance yohimbine in food supplement from the United Kingdom;dietetic foods, food supplements, fortified foods;food;serious; ;product traded online;food supplement;unauthorised substance yohimbine;composition;United Kingdom; ;Poland
735;771.0;alert;2019-07-04;2019.2401;Poland;unauthorised substance yohimbine in food supplement from the United Kingdom;dietetic foods, food supplements, fortified foods;food;serious; ;product traded online;food supplement;unauthorised substance yohimbine;composition;United Kingdom; ;Poland
736;773.0;border rejection;2019-07-04;2019.2405;Netherlands;ochratoxin A (26 µg/kg - ppb) in raisins from Turkey;fruits and vegetables;food;serious;official detention;product not (yet) placed on the market;raisins;ochratoxin a;mycotoxins;Turkey; ;Netherlands
737;775.0;border rejection;2019-07-04;2019.2403;Bulgaria;chlorpyrifos (0.092 mg/kg - ppm) and formetanate (0.043 mg/kg - ppm) in fresh peppers from Turkey;fruits and vegetables;food;serious;destruction;product not (yet) placed on the market;fresh peppers;chlorpyrifos,formetanate;pesticide residues,pesticide residues;Turkey; ;Bulgaria,Germany
738;777.0;border rejection;2019-07-04;2019.2393;Netherlands;aflatoxins (Tot. = 8.9 µg/kg - ppb) in groundnuts from Argentina;nuts, nut products and seeds;food;serious;official detention;product not (yet) placed on the market;groundnuts;aflatoxins;mycotoxins;Argentina; ;Netherlands
739;779.0;alert;2019-07-03;2019.2377;Germany;mustard (1.1 %) undeclared on soybean paste with seasoning from South Korea, via the Netherlands;soups, broths, sauces and condiments;food;serious;no stock left;distribution to other member countries;soybean paste with seasoning;mustard undeclared;allergens;South Korea;Austria,Belgium,Bulgaria,Cyprus,Czech Republic,Denmark,Finland,France,Germany,Greece,Hungary,Ireland,Italy,Luxembourg,Malta,Netherlands,Norway,Poland,Portugal,Romania,Slovakia,Slovenia,Spain,Sweden,Switzerland,United Kingdom;Commission Services,INFOSAN
740;781.0;border rejection;2019-07-03;2019.2383;Germany;too high count of Enterobacteriaceae (460 CFU/g) in fish meal from Turkey;feed materials;feed;not serious;physical/chemical treatment;product not (yet) placed on the market;fish meal;too high count of enterobacteriaceae;microbial contaminants (other);Turkey; ;Denmark,Germany
741;783.0;border rejection;2019-07-03;2019.2381;United Kingdom;poor temperature control (between 4.1 and 10.7 °C) of chilled sardines (Sardinella spp.) from India;fish and fish products;food;not serious;import not authorised;product not (yet) placed on the market;chilled sardines (sardinella spp.);poor temperature control;poor or insufficient controls;India; ;United Kingdom
742;785.0;alert;2019-07-03;2019.2378;Austria;too high intake of zinc (50 mg/day) from food supplement from the Netherlands, via Germany;dietetic foods, food supplements, fortified foods;food;undecided;no stock left;distribution to other member countries;food supplement;too high intake of zinc;metals;Netherlands;Austria,Germany;Commission Services
743;787.0;alert;2019-07-03;2019.2380;Italy;"aflatoxins (B1 = 15.8; Tot. = 16.6 µg/kg - ppb) in organic maize for pop corn from Italy";cereals and bakery products;food;serious;recall from consumers;distribution to other member countries;organic maize for pop corn;aflatoxins;mycotoxins;Italy;Italy,Malta; 
744;789.0;border rejection;2019-07-03;2019.2386;Poland;Salmonella (presence /25g) in sesame seeds from Nigeria;nuts, nut products and seeds;food;serious;re-dispatch;product not (yet) placed on the market;sesame seeds;salmonella;pathogenic micro-organisms;Nigeria; ;Poland
745;791.0;information for follow-up;2019-07-03;2019.2384;Belgium;"Salmonella enterica ser. Tennessee (in 3 out of 5 samples /25g) and high count of Enterobacteriaceae (330; 20; 30; 20; 20 CFU/g) in poultry meal from the United Kingdom";feed materials;feed;not serious;physical/chemical treatment;no distribution from notifying country;poultry meal;salmonella enterica ser. tennessee,high count of enterobacteriaceae;pathogenic micro-organisms,microbial contaminants (other);United Kingdom;Belgium; 
746;793.0;alert;2019-07-02;2019.2365;Switzerland;Salmonella (present /25g) in raw milk soft cheese from France;milk and milk products;food;serious;seizure;no distribution from notifying country;raw milk soft cheese;salmonella;pathogenic micro-organisms;France;Switzerland; 
747;795.0;information for attention;2019-07-02;2019.2366;Spain;too high count of Escherichia coli (8900 CFU/100g) in spiny dye-murex sea snails from Italy;gastropods;food;serious;no stock left;product (presumably) no longer on the market;spiny dye-murex sea snails;too high count of escherichia coli;microbial contaminants (other);Italy;Italy,Spain; 
748;797.0;alert;2019-07-02;2019.2371;Italy;sulphite (20.3 mg/kg - ppm) undeclared on candied orange peels covered with dark chocolate from Italy;cocoa and cocoa preparations, coffee and tea;food;serious;recall from consumers;distribution to other member countries;candied orange peels covered with dark chocolate;sulphite undeclared;food additives and flavourings;Italy;Bahrain,Czech Republic,Italy,Oman,Slovenia;INFOSAN
749;799.0;alert;2019-07-02;2019.2370;Denmark;plastic fragments in vitamin smoothies from Denmark;non-alcoholic beverages;food;undecided;withdrawal from recipient(s);distribution to other member countries;vitamin smoothies;plastic fragments;foreign bodies;Denmark;Norway,Sweden; 
750;702.0;information for attention;2019-07-09;2019.2483;Lithuania;"aflatoxins (B1 = 29.6; Tot. = 36.5 µg/kg - ppb) in caramel candies with peanuts from Ukraine";confectionery;food;serious;destruction;distribution restricted to notifying country;caramel candies with peanuts;aflatoxins;mycotoxins;Ukraine;Lithuania;INFOSAN
751;704.0;border rejection;2019-07-09;2019.2475;Italy;"aflatoxins (B1 = 42.1; Tot. = 46.8 mg/kg - ppm) in groundnuts in shell from Egypt";nuts, nut products and seeds;food;serious;placed under customs seals;product not (yet) placed on the market;groundnuts in shell;aflatoxins;mycotoxins;Egypt; ;Italy
752;706.0;information for follow-up;2019-07-08;2019.2459;Netherlands;buttermilk from Belgium unfit for animal nutrition (mixture of milk residue and rinsing water);feed materials;feed;undecided; ;distribution to other member countries;buttermilk;unfit for animal nutrition;poor or insufficient controls;Belgium;Belgium,Netherlands; 
753;708.0;alert;2019-07-08;2019.2448;United Kingdom;fish (salmon) undeclared on prepared dish from the United Kingdom;prepared dishes and snacks;food;serious;recall from consumers;distribution to other member countries;prepared dish;fish undeclared;allergens;United Kingdom;Guernsey,Ireland,Isle of Man,Jersey,United Kingdom;INFOSAN
754;710.0;information for attention;2019-07-08;2019.2458;Germany;pyrrolizidine alkaloids (10526 µg/kg - ppb) in oregano from Turkey;herbs and spices;food;serious;detained by operator;distribution restricted to notifying country;oregano;pyrrolizidine alkaloids;natural toxins (other);Turkey;Germany;INFOSAN
755;712.0;border rejection;2019-07-08;2019.2456;Germany;metalaxyl (1.83 mg/kg - ppm) and acetamiprid (1.47 mg/kg - ppm) and unauthorised substances carbendazim (11.3 mg/kg - ppm), fipronil (0.34 mg/kg - ppm) and triazophos (2.17 mg/kg - ppm) in chili peppers from Thailand;fruits and vegetables;food;serious;destruction;product not (yet) placed on the market;chili peppers;acetamiprid,metalaxyl,unauthorised substance carbendazim,unauthorised substance fipronil,unauthorised substance triazophos;pesticide residues,pesticide residues,pesticide residues,pesticide residues,pesticide residues;Thailand; ;Germany
756;714.0;border rejection;2019-07-08;2019.2462;Germany;Salmonella (present /25g) in sesame seeds from India;nuts, nut products and seeds;food;serious;re-dispatch;product not (yet) placed on the market;sesame seeds;salmonella;pathogenic micro-organisms;India; ;Germany
757;716.0;border rejection;2019-07-08;2019.2464;Germany;Salmonella enterica ser. Adelaide (in 1 out of 5 samples /25g) in organic sesame seeds from Uganda;nuts, nut products and seeds;food;serious;re-dispatch;product not (yet) placed on the market;organic sesame seeds;salmonella enterica ser. adelaide;pathogenic micro-organisms;Uganda; ;Germany,United Arab Emirates
758;718.0;border rejection;2019-07-08;2019.2465;Germany;Salmonella enterica ser. Adelaide (presence /25g) in sesame seeds from Uganda;nuts, nut products and seeds;food;serious;re-dispatch;product not (yet) placed on the market;sesame seeds;salmonella enterica ser. adelaide;pathogenic micro-organisms;Uganda; ;Germany,Switzerland
759;720.0;border rejection;2019-07-08;2019.2460;Belgium;"aflatoxins (B1 = 781; Tot. = 975 µg/kg - ppb) in groundnuts from Sudan";nuts, nut products and seeds;food;undecided;import not authorised;product not (yet) placed on the market;groundnuts;aflatoxins;mycotoxins;Sudan; ;Belgium,Netherlands
760;722.0;border rejection;2019-07-08;2019.2468;Belgium;"aflatoxins (B1 = 7.3; Tot. = 8.1 µg/kg - ppb) in groundnuts from Sudan";nuts, nut products and seeds;food;serious;import not authorised;product not (yet) placed on the market;groundnuts;aflatoxins;mycotoxins;Sudan; ;Belgium,Netherlands
761;724.0;information for follow-up;2019-07-08;2019.2453;Spain;unauthorised substance tetrahydrocannabinol (THC) and unauthorised novel food ingredient cannabidiol (CBD) in chewing gum, chocolate and infusion from Spain;other food product / mixed;food;undecided;withdrawal from the market;distribution to other member countries;chewing gum, chocolate and infusion;unauthorised novel food ingredient cannabidiol (cbd),unauthorised substance tetrahydrocannabinol (thc);novel food,composition;Spain;Portugal,Spain;Netherlands
762;726.0;information for follow-up;2019-07-05;2019.2423;Germany;Salmonella (presence /25g) in organic sunflower cake from Ukraine, via Lithuania;feed materials;feed;not serious;detained by operator;distribution to other member countries;organic sunflower cake;salmonella;pathogenic micro-organisms;Ukraine;Germany,Netherlands;Lithuania
763;728.0;alert;2019-07-05;2019.2430;Ireland;insufficient labelling (nuts and sesame seeds not in ingredients list) of mixed chocolates from Belgium;cocoa and cocoa preparations, coffee and tea;food;serious;public warning - press release;distribution to other member countries;mixed chocolates;insufficient labelling;labelling absent/incomplete/incorrect;Belgium;Chile,Curaçao,Cyprus,Finland,Germany,Greece,Ireland,Jersey,South Korea,Spain,Taiwan,United Kingdom,United States;INFOSAN,Netherlands
764;730.0;alert;2019-07-05;2019.2435;France;high count of Escherichia coli (up to 1 100 000 CFU/g) in goat cheese from France;milk and milk products;food;undecided;withdrawal from the market;distribution to other member countries;goat cheese;high count of escherichia coli;microbial contaminants (other);France;France,Hong Kong,Ireland,Italy,Netherlands,Philippines,Portugal,Romania,Singapore,Spain,United Kingdom;INFOSAN
765;732.0;alert;2019-07-05;2019.2431;Italy;mercury (1.5 mg/kg - ppm) in frozen blue shark (Prionace glauca) from Italy, with raw material from Spain;fish and fish products;food;serious;withdrawal from recipient(s);distribution restricted to notifying country;frozen blue shark (prionace glauca);mercury;metals;Italy,Spain;Italy; 
766;734.0;border rejection;2019-07-05;2019.2410;Netherlands;Salmonella (presence /25g) in sesame seeds from Nigeria;nuts, nut products and seeds;food;serious;official detention;product not (yet) placed on the market;sesame seeds;salmonella;pathogenic micro-organisms;Nigeria; ;Netherlands,Singapore
767;736.0;alert;2019-07-05;2019.2437;France;"Listeria monocytogenes (160; <40 CFU/g) in gorgonzola from Italy";milk and milk products;food;serious;recall from consumers;information on distribution not (yet) available;gorgonzola;listeria monocytogenes;microbial contaminants (other);Italy;France; 
768;738.0;information for attention;2019-07-05;2019.2433;France;Listeria monocytogenes (presence /25g) in raw milk cow's cheese;milk and milk products;food;serious;recall from consumers;product (presumably) no longer on the market;raw milk cow's cheese;listeria monocytogenes;microbial contaminants (other); ;Belgium,Canada,Denmark,Germany;France,INFOSAN,Lithuania
769;740.0;information for follow-up;2019-07-05;2019.2408;Germany;unauthorised novel food sweet wormwood (Artemisia annua) from Germany;dietetic foods, food supplements, fortified foods;food;undecided;recall from consumers;distribution to other member countries;sweet wormwood (artemisia annua);unauthorised novel food;novel food;Germany;Austria,France,Germany,Italy,Switzerland;Commission Services
770;742.0;information for follow-up;2019-07-05;2019.2438;Netherlands;lead (33.55 mg/kg - ppm) in magnesium oxide from Germany, with raw material from China;feed materials;feed;not serious;return to consignor;distribution restricted to notifying country;magnesium oxide;lead;metals;China,Germany;Netherlands; 
771;744.0;information for attention;2019-07-05;2019.2441;France;high count of Escherichia coli (190 000 CFU/g) in chilled burrata from Italy;milk and milk products;food;serious;informing authorities;product (presumably) no longer on the market;chilled burrata;high count of escherichia coli;microbial contaminants (other);Italy;France; 
772;746.0;border rejection;2019-07-05;2019.2440;Poland;absence of health certificate(s) and of certified analytical report for nutmeg from Indonesia;herbs and spices;food;not serious;re-dispatch;product not (yet) placed on the market;nutmeg;absence of certified analytical report,absence of health certificate(s);adulteration / fraud,adulteration / fraud;Indonesia; ;Poland
773;748.0;alert;2019-07-05;2019.2434;France;foreign body (piece of plastic) in canned tuna from Spain;fish and fish products;food;serious;informing consignor;distribution restricted to notifying country;canned tuna;foreign body;foreign bodies;Spain;France; 
774;750.0;alert;2019-07-05;2019.2422;Slovenia;"aflatoxins (B1 = 21; Tot. = 23 µg/kg - ppb) in sunflower seeds from Serbia";nuts, nut products and seeds;food;serious; ;distribution to other member countries;sunflower seeds;aflatoxins;mycotoxins;Serbia;Italy;INFOSAN,Slovenia
775;752.0;border rejection;2019-07-05;2019.2432;Greece;absence of Common Entry Document (CED) for frozen raspberries from Serbia;fruits and vegetables;food;not serious;re-dispatch;product not (yet) placed on the market;frozen raspberries;absence of common entry document (ced);adulteration / fraud;Serbia; ;Commission Services,Greece
776;754.0;information for attention;2019-07-05;2019.2407;Spain;norovirus (genogroup II) in live oysters from France;bivalve molluscs and products thereof;food;serious; ;product (presumably) no longer on the market;live oysters;norovirus;pathogenic micro-organisms;France;Spain; 
777;756.0;border rejection;2019-07-05;2019.2439;Italy;migration of nickel (0.7 mg/kg - ppm) from barbecue grills from China;food contact materials;fcm;undecided;return to consignor;product not (yet) placed on the market;barbecue grills;migration of nickel;metals;China; ;Italy
778;758.0;information for attention;2019-07-05;2019.2411;Poland;unauthorised substances yohimbine and 1,3-dimethylamylamine (DMAA) in food supplement from the United States;dietetic foods, food supplements, fortified foods;food;serious; ;product traded online;food supplement;unauthorised substance 1,3-dimethylamylamine (dmaa),unauthorised substance yohimbine;composition,composition;United States; ;INFOSAN,Poland
779;760.0;information for attention;2019-07-05;2019.2415;Spain;norovirus (GI /2g) in live oysters (Crassostrea gigas) from France;bivalve molluscs and products thereof;food;serious;informing authorities;product (presumably) no longer on the market;live oysters (crassostrea gigas);norovirus;pathogenic micro-organisms;France;Spain; 
780;762.0;border rejection;2019-07-05;2019.2412;Netherlands;aflatoxins (Tot. = 9.1 µg/kg - ppb) in raw peanuts from Argentina;nuts, nut products and seeds;food;serious;official detention;product not (yet) placed on the market;raw peanuts;aflatoxins;mycotoxins;Argentina; ;Netherlands
781;764.0;alert;2019-07-04;2019.2398;Italy;too high count of Escherichia coli (330 MPN/100g) in live clams (Chamelea gallina) from Italy;bivalve molluscs and products thereof;food;serious;withdrawal from the market;distribution to other member countries;live clams (chamelea gallina);too high count of escherichia coli;microbial contaminants (other);Italy;Italy,Spain; 
782;766.0;information for follow-up;2019-07-04;2019.2394;Hungary;turkey sausages from Poland unfit for human consumption (containing pieces of feathers);poultry meat and poultry meat products;food;undecided; ;no distribution from notifying country;turkey sausages;unfit for human consumption;poor or insufficient controls;Poland;Hungary;Commission Services
783;768.0;border rejection;2019-07-04;2019.2406;United Kingdom;attempt to illegally import melon seeds from Nigeria;nuts, nut products and seeds;food;not serious;import not authorised;product not (yet) placed on the market;melon seeds;attempt to illegally import;adulteration / fraud;Nigeria; ;United Kingdom
784;770.0;information for follow-up;2019-07-04;2019.2396;Germany;too high content of nickel (17.4 mg/kg - ppm) in textured soy protein from Switzerland;other food product / mixed;food;not serious; ;no distribution from notifying country;textured soy protein;nickel;metals;Switzerland;Germany; 
785;772.0;border rejection;2019-07-04;2019.2404;Netherlands;aflatoxins (Tot. = 13 µg/kg - ppb) in peanuts from Argentina;nuts, nut products and seeds;food;serious;official detention;product not (yet) placed on the market;peanuts;aflatoxins;mycotoxins;Argentina; ;Netherlands
786;774.0;border rejection;2019-07-04;2019.2402;Netherlands;"aflatoxins (B1 = 120; Tot. = 140 µg/kg - ppb) in groundnut kernels from Sudan";feed materials;feed;serious;return to consignor;product not (yet) placed on the market;groundnut kernels;aflatoxins;mycotoxins;Sudan; ;Netherlands
787;776.0;border rejection;2019-07-04;2019.2400;Germany;aflatoxins (B1 = 6.0 µg/kg - ppb) in groundnuts with shell from Egypt;nuts, nut products and seeds;food;serious;re-dispatch;product not (yet) placed on the market;groundnuts with shell;aflatoxins;mycotoxins;Egypt; ;Germany
788;778.0;border rejection;2019-07-04;2019.2390;Netherlands;"aflatoxins (B1 = 140; Tot. = 160 µg/kg - ppb) in groundnuts from Sudan";feed materials;feed;serious;official detention;product not (yet) placed on the market;groundnuts;aflatoxins;mycotoxins;Sudan; ;Netherlands
789;780.0;alert;2019-07-03;2019.2382;Italy;sulphite (91 mg/kg - ppm) undeclared on frozen vacuum-packed octopus (Octopus membranaceus) from Italy;cephalopods and products thereof;food;serious;no stock left;distribution to other member countries;frozen vacuum-packed octopus (octopus membranaceus);sulphite undeclared;food additives and flavourings;Italy;Italy,Malta;INFOSAN,Vietnam
790;782.0;alert;2019-07-03;2019.2376;Belgium;Listeria monocytogenes (presence /25g) in chilled smoked salmon from Belgium;fish and fish products;food;serious;public warning - press release;distribution to other member countries;chilled smoked salmon;listeria monocytogenes;microbial contaminants (other);Belgium;Belgium,France,Germany,Luxembourg,Netherlands; 
791;784.0;alert;2019-07-03;2019.2385;Austria;unauthorised substance tetrahydrocannabinol (THC) (344 mg/kg - ppm) and unauthorised novel food ingredient cannabidiol (CBD) (2360 mg/kg - ppm) in CBD honey from Spain;honey and royal jelly;food;serious;no stock left;no distribution from notifying country;cbd honey;unauthorised novel food ingredient cannabidiol (cbd),unauthorised substance tetrahydrocannabinol (thc);novel food,composition;Spain;Austria;Germany,Netherlands
792;786.0;alert;2019-07-03;2019.2387;United Kingdom;apple and blackcurrant drink from the United Kingdom with defective packaging (choking hazard);non-alcoholic beverages;food;serious;recall from consumers;distribution to other member countries;apple and blackcurrant drink;defective packaging;packaging defective / incorrect;United Kingdom;Belgium,Iraq,Netherlands,Spain,Suriname;INFOSAN
793;788.0;information for attention;2019-07-03;2019.2375;Denmark;incorrect labelling (allergens not labelled in Danish) on various tortelloni pasta from Germany;prepared dishes and snacks;food;serious;recall from consumers;distribution restricted to notifying country;various tortelloni pasta;incorrect labelling;labelling absent/incomplete/incorrect;Germany;Denmark; 
794;790.0;information for attention;2019-07-03;2019.2379;Italy;unauthorised substance tricyclazole (0.025 mg/kg - ppm) in parboiled rice from Italy;cereals and bakery products;food;undecided;withdrawal from recipient(s);distribution to non-member countries;parboiled rice;unauthorised substance tricyclazole;pesticide residues;Italy;Albania,Italy,Kosovo,San Marino; 
795;792.0;alert;2019-07-02;2019.2367;Austria;Salmonella enterica ser. anatum (presence /25g) in dog chews from Poland, via Germany;pet food;feed;serious;withdrawal from the market;distribution to other member countries;dog chews;salmonella enterica ser. anatum;pathogenic micro-organisms;Poland;Austria,Belgium,Denmark,France,Germany,Hungary,Ireland,Italy,Luxembourg,Poland,Switzerland; 
796;794.0;border rejection;2019-07-02;2019.2373;Malta;mustard undeclared on curry mix from Egypt;herbs and spices;food;serious;relabelling;product not (yet) placed on the market;curry mix;mustard undeclared;allergens;Egypt; ;Malta
797;796.0;information for follow-up;2019-07-02;2019.2369;Sweden;unauthorised novel food ingredient cannabidiol (CBD) in CBD oil from unknown origin;dietetic foods, food supplements, fortified foods;food;undecided; ;product traded online;cbd oil;unauthorised novel food ingredient cannabidiol (cbd);novel food;unknown origin; ;Sweden,United Kingdom
798;798.0;information for attention;2019-07-02;2019.2374;Spain;norovirus (GI, GII /2g) in live venus clams (Chamelea gallina) from Italy;bivalve molluscs and products thereof;food;undecided; ;product (presumably) no longer on the market;live venus clams (chamelea gallina);norovirus;pathogenic micro-organisms;Italy;Spain; 
799;800.0;information for attention;2019-07-02;2019.2372;Spain;norovirus (GI and GII /2g) in live venus clams (Chamelea gallina) from Italy;bivalve molluscs and products thereof;food;undecided; ;product (presumably) no longer on the market;live venus clams (chamelea gallina);norovirus;pathogenic micro-organisms;Italy;Spain; 
800;801.0;information for follow-up;2019-07-02;2019.2368;Spain;unauthorised novel food ingredient cannabidiol (CBD) (6.23 %) in hemp oil from Germany;fats and oils;food;undecided; ;information on distribution not (yet) available;hemp oil;unauthorised novel food ingredient cannabidiol (cbd);novel food;Germany; ;Netherlands,Spain
801;803.0;alert;2019-07-01;2019.2346;United Kingdom;plastic fragments in frozen chicken dippers from Germany;poultry meat and poultry meat products;food;serious;recall from consumers;distribution to other member countries;frozen chicken dippers;plastic fragments;foreign bodies;Germany;Cyprus,Czech Republic,Ireland,Jersey,Malta,Saint Helena,Spain,Thailand,United Kingdom;INFOSAN
802;805.0;alert;2019-07-01;2019.2355;Ireland;plastic fragments (small blue plastic pieces) in chilled black pudding from Ireland;meat and meat products (other than poultry);food;serious;public warning - press release;distribution to other member countries;chilled black pudding;plastic fragments;foreign bodies;Ireland;Ireland,United Kingdom; 
803;807.0;information for attention;2019-07-01;2019.2352;Italy;parasitic infestation with Anisakis (up to 10 larvae) of chilled mackerel (Scomber scombrus) from France;fish and fish products;food;not serious;informing recipient(s);product (presumably) no longer on the market;chilled mackerel (scomber scombrus);parasitic infestation with anisakis;parasitic infestation;France;Italy;Spain
804;809.0;border rejection;2019-07-01;2019.2361;Spain;poor temperature control ( -12.7,-11.3,-12.3,-12.2,-14.3,-14.6,-15.1, -14.5,-17.7,-17.2 °C) of frozen shrimps from Morocco;crustaceans and products thereof;food;not serious;import not authorised;product not (yet) placed on the market;frozen shrimps;poor temperature control;poor or insufficient controls;Morocco; ;Spain
805;811.0;border rejection;2019-07-01;2019.2351;Italy;"aflatoxins (B1 = 90.6; Tot. = 181.3 / B1 = 19.4; Tot. = 27.8 µg/kg - ppb) in pistachio nuts from Turkey";nuts, nut products and seeds;food;serious;re-dispatch;product not (yet) placed on the market;pistachio nuts;aflatoxins;mycotoxins;Turkey; ;Italy
806;813.0;border rejection;2019-07-01;2019.2363;Netherlands;Salmonella (in 1 out of 5 samples /25g) in organic sesame seeds from Uganda;nuts, nut products and seeds;food;serious;physical/chemical treatment;product not (yet) placed on the market;organic sesame seeds;salmonella;pathogenic micro-organisms;Uganda; ;Netherlands
807;815.0;border rejection;2019-07-01;2019.2364;Netherlands;Salmonella (in 1 out of 5 samples /25g) in black pepper from Brazil;herbs and spices;food;serious;official detention;product not (yet) placed on the market;black pepper;salmonella;pathogenic micro-organisms;Brazil; ;Netherlands
808;817.0;border rejection;2019-07-01;2019.2348;Bulgaria;chlorpyrifos (0.208 mg/kg - ppm) in peppers from Turkey;fruits and vegetables;food;serious;re-dispatch;product not (yet) placed on the market;peppers;chlorpyrifos;pesticide residues;Turkey; ;Bulgaria,Romania
